"Day","Title","Start","End","Facilitator/
Host camp","Location","Category","Vibes","Description","Comments","KID FRIENDLY","SEX POSITIVE","QUEER INCLUSIVE","ADULT ONLY","SOBER ONLY","Warning: Sensory content ","Warning: Triggering"
"Thu. 23 July","Flow Prop Playground","18:00","19:00","Fire Brigade / Fire Brigade","Swamp, grid square S16. In The Swamp at Fire Plaza, a gallery and red carpet area opposite the large tent of CIRCUS the ANALOG.","Yoga/Movement/Bodywork","","You keep seeing these mythical creatures playing with fire and lights? Anyone can learn it! This is an opportunity to try out different toys and learn some tricks. No matter if you’re completely new to flow arts, want to try a prop you haven’t before, or practice one you know well.","Recurring: expanded to 4 days (Mon. 20 July, Tue. 21 July, Thu. 23 July, Fri. 24 July); shown on: Thu. 23 July","FALSE","FALSE","FALSE","FALSE","FALSE","FALSE","FALSE"
"Thu. 23 July","Foxy Temple Night","18:00","20:00","Besties from Berlin / Foxhole","Lowlands, grid square Q11.","Workshop/Class","🦍 Adults only · 😇 Sober · 🖤 Sex positive","Temple is a deep dive into sensual erotic play. In a space of presence, “foxyness” and fun, you will learn how to enjoy yourself and connect with others in a sensual manner. Please be familiar with consent. Sensual outfits are welcome, but not a must <3","","FALSE","TRUE","FALSE","TRUE","TRUE","FALSE","FALSE"
"Thu. 23 July","Create Your Own UV Sticker - Drop in","18:00","20:00","Trollungen / Gate of Alvheim","Muumin Valley, grid square F10. Just find the colors at the Kishmastle","Crafting/Pimping/Arting","🐵 Kid-friendly · 🌈 Queer-inclusive","Drop by and create your own handmade UV sticker with colorful markers and sticker paper — a forest spirit, mushroom, funny creature, or anything that sparks your imagination. A relaxed drop-in session at your own pace; I'll share ideas if you want guidance. The listed time is when I'll definitely be at Kishmastle, but the station returns at various times all week — and if you spot me wandering the playa with the kit, stop and make a sticker! No experience needed.","","TRUE","FALSE","TRUE","FALSE","FALSE","FALSE","FALSE"
"Thu. 23 July","Shisha night at Socialen","18:00","21:00","Socialen","Bison - South, grid square O22. Sunset plaza","Food/Drinks","","The Playa is transforming from daytime playground to nighttime adventure. Rest your legs & butts, meet new friends over shared shisha and tea, and prepare for the adventures of the night!","Recurring: expanded to 2 days (Tue. 21 July, Thu. 23 July); shown on: Thu. 23 July","FALSE","FALSE","FALSE","FALSE","FALSE","FALSE","FALSE"
"Thu. 23 July","Womens' Oasis: Land, Reflect & Connect","18:15","20:15","Klara Berg, Anna Goslund / Tantric Trolls","Highlands, grid square N11. Penta Plaza","Workshop/Class","🦍 Adults only · 😇 Sober","A gentle space for women to gather, land, and reconnect with themselves and each other amidst the intensity of Borderland. Through reflection, sharing, and simple exercises with optional light physical contact, we create room to notice what the festival has stirred, awakened, or revealed so far. Come as you are and join us for a calm moment of presence, connection, and rest.","","FALSE","FALSE","FALSE","TRUE","TRUE","FALSE","FALSE"
"Thu. 23 July","BorderLAN 2002","19:00","22:00","Jonas Johansson / Dreamers Maze","The Villa, grid square K14.","Art/Installation","🦍 Adults only · 💥 Sensory content","The BorderLAN returns and the year is 2002. During the day you are welcome for unsolicited play, and in the evening a party of four can book a 45-min slot and enjoy an authentic 2002 LAN experience. Learn more and book at www.borderlan.land.","Recurring: expanded to 2 days (Tue. 21 July, Thu. 23 July); shown on: Thu. 23 July","FALSE","FALSE","FALSE","TRUE","FALSE","TRUE","FALSE"
"Thu. 23 July","Bistro Francais Happy Hour","19:00","20:00","Le Bistro Francais","Lowlands, grid square Q12. We welcome you at the Lowlands Plaza","Food/Drinks","🐵 Kid-friendly","Happy Hour à la Française! — Sparkling wine, peanuts, and the art of l’Apéro.","Recurring: expanded to 6 days (Mon. 20 July, Tue. 21 July, Wed. 22 July, Thu. 23 July, Fri.); shown on: Thu. 23 July","TRUE","FALSE","FALSE","FALSE","FALSE","FALSE","FALSE"
"Thu. 23 July","HOUSE OF LEMURIA OPEN FOR ENJOYMENT","19:00","0:00","Passage To Lemuria","grid square P25. The southest part of bison, look for a portal like entrance","Art/Installation","🌈 Queer-inclusive","Need a moment to land? Come rest in the space, soak in ambient sounds, explore the light installations and simply enjoy the space.","","FALSE","FALSE","TRUE","FALSE","FALSE","FALSE","FALSE"
"Thu. 23 July","Temple Night: A Sensual Journey Through the Senses","19:00","23:00","Frida & Villu, from House of Lust / The Genie's Lamp","Highlands, grid square N13. Agrabah Village, in south eastern Highlands","Ritual/Ceremony","🦍 Adults only · 🖤 Sex positive · 😇 Sober","Sensual rituals, guided meetings, and playful experiences. Arrive to this clothes-on play space with a partner, friend, or lover you already know and trust. During the session you can be invited to explore encounters with many different participants. Dress code: a royal visit to the Genie’s Lamp!","","FALSE","TRUE","FALSE","TRUE","TRUE","FALSE","FALSE"
"Thu. 23 July","Naked Contact Improvisation workshop","19:00","20:30","Baher / ❤️ The Heart ❤️","Highlands, grid square M11. Look out for the flag with the big heart on it!","Yoga/Movement/Bodywork","🦍 Adults only","Open to all curious bodies to explore creative and playful dancing through bodyweight-sharing, balance, and creative expression. Via guided exercises and open dance jam, participants discover new ways of moving, listening, and responding through the body in a respectful and consent-aware space.","","FALSE","FALSE","FALSE","TRUE","FALSE","FALSE","FALSE"
"Thu. 23 July","Skipping like Kids","19:00","19:30","Luka / ❤️ The Heart ❤️","Highlands, grid square M11. Look out for the flag with the big heart on it!","Yoga/Movement/Bodywork","","Do you still do ""skipping""? Do you remember how we all used to skip as kids? Skipping is the art of effortles movement. It's the closest thing to flying. Feels like bouncing the Earth away from us, not the other way around. Skipping!","","FALSE","FALSE","FALSE","FALSE","FALSE","FALSE","FALSE"
"Thu. 23 July","Deep Sym Immersive Breathwork","19:00","21:00","Kira / Yggdrasil","Highlands, grid square O10. in the big Tipi","Art/Installation","","See your breath in light. Feel calm and connected. Expand the diaphragm, explore pranayama breathwork and connect using Sym - an interactive art object that visualises breathing real-time in a soothing light, using custom sensors. As we sync our breath, Sym radiates with rainbows! Limited capacity.","","FALSE","FALSE","FALSE","FALSE","FALSE","FALSE","FALSE"
"Thu. 23 July","Impale Your Dough!","19:00","22:00","","Find a campfire and hope that we're there","Food/Drinks","🐵 Kid-friendly · 😇 Sober · 🌈 Queer-inclusive","We’ll make dough, collect+sharpen sticks and bring everything to bonfires around Borderland and feed the hungry masses.","Recurring: expanded to 3 days (Tue. 21 July, Wed. 22 July, Thu. 23 July); shown on: Thu. 23 July","TRUE","FALSE","TRUE","FALSE","TRUE","FALSE","FALSE"
"Thu. 23 July","Feather-light touch workshop","19:30","20:30","Meri / ❤️ The Heart ❤️","Highlands, grid square M11. Look out for the flag with the big heart on it!","Workshop/Class","🦍 Adults only","Experience the calming power of feather-light touch in this partnered workshop. Learn simple, mindful massage techniques, take turns giving and receiving, and explore relaxation, presence, and connection in a safe, guided environment. Bring a yoga mat.","","FALSE","FALSE","FALSE","TRUE","FALSE","FALSE","FALSE"
"Thu. 23 July","Folk Music Jam","19:30","20:30","The Tribe's Boy / The Tribe, Agraba Village","Highlands, grid square N13. Search for the Tribal Mystics in Agraba village, Highlands","Ritual/Ceremony","🐵 Kid-friendly","We share and play folk music together. Bring an instrument or just your voice. No music knowledge needed.","","TRUE","FALSE","FALSE","FALSE","FALSE","FALSE","FALSE"
"Thu. 23 July","Riktigt Blackwater-Party","20:00","21:30","Maj. Ander / Blackwater Operations","Swamp, grid square Q18. Look for the American flag","Weird shit/Other","🚨 Triggering themes · 💥 Sensory content","The ultimate celebration of the resilient Blackwater Operations, the diligent BOWELS and our beloved Freedom. Known to put the art in the party, Maj. Ander invites You to a Riktigt Party, with me: Alexander Näslund.","","FALSE","FALSE","FALSE","FALSE","FALSE","TRUE","TRUE"
"Thu. 23 July","PowerPoint Karaoke","20:00","22:00","Palle / Chilldome","Highlands, grid square M11. Big dome on the Penta Plaza.","Music/Performance/Show","","Welcome to our executive presentation simulator. Roll for a slideshow from our curated library and present it like you wrote it yourself. No preparation. No context. Just confidence, business buzzwords, and impeccable delivery.","","FALSE","FALSE","FALSE","FALSE","FALSE","FALSE","FALSE"
"Thu. 23 July","AYA - The portal","20:00","21:30","AYA / Circus the analogue","Swamp, grid square S18. We’re located in the swampedi Swamp. 
Right in the Center of fire, earth & water plaza. 
IN THE WOMB OF EXISTENCE.","Music/Performance/Show","🦍 Adults only · 🌈 Queer-inclusive","Step into the portal to a new world — AYA's world, her music & her art. ""Do you know this feeling when your whole life is falling apart? But actually it is rearranging itself, so you can live true to your heart."" A musical playformance by AYA — a journey from past to present. AN INFINITE MOMENT OF PRESENCE. Let go of the old, play & come alive. Huggies from your everlasting wife, Aya 😘","","FALSE","FALSE","TRUE","TRUE","FALSE","FALSE","FALSE"
"Thu. 23 July","DanSINg: Tech House & Techno Night","20:00","2:00","Club SIN","Bison - North, grid square N19. By the Shameless Plaza","Music/Performance/Show","🦍 Adults only · 💥 Sensory content","20.00 Mia Lafontaine
Edgy and playful, energy and elegance on a groovy, soulful journey 
21.30 Technymph
Euphoric, driving tech house and techno 
23.00 Axel (Shoulder B) 
Tech house ramping up to techno 
00.30 Memory Play 
Immersive, hypnotic, psychedelic and driving techno with guttural vocals","","FALSE","FALSE","FALSE","TRUE","FALSE","TRUE","FALSE"
"Thu. 23 July","CaSINo: Bet Your Soul and Body","20:00","2:00","Club SIN","Bison - North, grid square N19. By the Shameful Plaza","Games/Play","🦍 Adults only","CaSINo is Club SIN’s twisted casino, where sincoins, shame, dignity, luck, and temptation are all on the table. Play sinful casino games; blackjack, poker, and roulette, win juicy treats, accept delicious punishments, and gamble your comfort zone away. Come place your bet, commit your sins, and lose yourself with us tonight at caSINo...","Recurring: expanded to 4 days (Mon. 20 July, Tue. 21 July, Wed. 22 July, Thu. 23 July); shown on: Thu. 23 July","FALSE","FALSE","FALSE","TRUE","FALSE","FALSE","FALSE"
"Thu. 23 July","SIN Bar: Become Your Sinful Self","20:00","2:00","Club SIN","Bison - North, grid square N19. By the Shameful Plaza","Food/Drinks","🦍 Adults only · 💥 Sensory content","Commit wicked sins or accept deserved punishments from our curated menus at SIN Bar, Club SIN's handcrafted wooden haven beside the dancefloor. Earn sincoins, ask nicely, and our SINtenders may reward you with cocktails, non-alcoholic delights, special snacks, and redeeming treats. Sinful tonight?","Recurring: expanded to 4 days (Mon. 20 July, Tue. 21 July, Wed. 22 July, Thu. 23 July); shown on: Thu. 23 July","FALSE","FALSE","FALSE","TRUE","FALSE","TRUE","FALSE"
"Thu. 23 July","Fusion Dance Night","20:00","23:00","Lene and Daniel / DansBanderLand","Swamp, grid square T19. The LED dansbana (= pavilion)","Yoga/Movement/Bodywork","","Welcome to a night of blending dances together. First we warm up with contact impro and establish limits. After that we will host 15 min workshops in bug, bachata and kizomba/folkdans? , encouraging you to blend all styles.","","FALSE","FALSE","FALSE","FALSE","FALSE","FALSE","FALSE"
"Thu. 23 July","Kitty Wedding (Get Meowrried)","20:00","22:00","Juicy, Catnip, Lulla Li / End of the Rainbow","Bison - North, grid square N20. Cross from downtown garden over the wooden bridge by  the wood storage or enter from the Shameless Plaza below Club Sin","Ritual/Ceremony","🦍 Adults only · 🌈 Queer-inclusive · 🖤 Sex positive · 💥 Sensory content","Declare your love to your favorite Kitty and get Meowrried on Borderland at the fantastical Kitty wedding!  Each will get the chance to have a personalised ceremony and you can even get officially married by a certified wedding officiant. It will be ""first come first served""","","FALSE","TRUE","TRUE","TRUE","FALSE","TRUE","FALSE"
"Thu. 23 July","SoloLand","20:00","5:00","GlitterTind","Bison - North, grid square O20. Shameless plaza next to sinnergirl","Party/Gathering","🦍 Adults only · 💥 Sensory content · 🖤 Sex positive · 🌈 Queer-inclusive","The Mountain King has awakened and invites you into his throne hall to discover new connections. Whether you arrive solo, with a partner, or with a friend, join us in celebrating human connection through music, movement, performances, and playful games. Arrive at 20:00 for the Igniting Opening, and as the sun rises, we'll land together with a sound bath.","","FALSE","TRUE","TRUE","TRUE","FALSE","TRUE","FALSE"
"Thu. 23 July","Cheese Doctors @ Institute of Insanity","20:00","21:00","Institute of Insanity","We show up at various spots on the playa","Food/Drinks","🦍 Adults only","Interactive pop‑up Performance by The Cheese Doctors @ The Institute of Insanity: reality‑bending experiments, cheese‑based treatments, and strictly confidential participation. Are you ready to be examined by cheese?","Recurring: expanded to 3 days (Tue. 21 July, Thu. 23 July, Fri. 24 July); shown on: Thu. 23 July","FALSE","FALSE","FALSE","TRUE","FALSE","FALSE","FALSE"
"Thu. 23 July","Saying Farewell To The Pre-AGI/Superintelligence Era","20:00","21:00","Jonathan / Jousting Jesters","Swamp, grid square Q19. The medieval camp by the little forest in Swamp, on the side facing the empty field","Ritual/Ceremony","","The world is changing. The world will never be the same. Whether you think this epochal transformation will be for good or ill, we are here to say goodbye to the old world

We gather while the present is still ordinary enough to recognize - the only world any of us have known. At the precipice of great change, we meet in uncertainty, to feel what matters, to share what we fear losing, and to carry it forward together.","","FALSE","FALSE","FALSE","FALSE","FALSE","FALSE","FALSE"
"Thu. 23 July","The rise of Chai-Hullud!","20:00","23:00","Space-Jarl Zaaki and the band of frenzied Fremen / Njorunns (Space) Garden","Downtown, grid square M20. The mighty worm will work its way throughout the Playa","Food/Drinks","🐵 Kid-friendly · 🌈 Queer-inclusive · 🚨 Triggering themes","As the dusk settles on the playa on this fateful nigh, the legend of the thrashy sandworm with innards of pure hot Chai-gold will begin. Keep your eyes peeled for the 10m long creation rolling around and living its best life. Hot beverage will be served to those who dare interact, and perhaps something special for those daring the mysteries of the pain-box...","","TRUE","FALSE","TRUE","FALSE","FALSE","FALSE","TRUE"
"Thu. 23 July","Fireside talk","20:00","22:00","Heinz / Secret Garden","Downtown, grid square M21. Come to the Växthus in Secret Garden","Weird shit/Other","😇 Sober · 🚨 Triggering themes","Let's have a deep and authentic dialogue about important and controversial topics. Maybe it's something Borderland related, or something from the default world that impacts us all. Let's listen to each other's perspective with an open heart and mind and maybe we can integrate all those polarities a bit more.","Recurring: expanded to 4 days (Tue. 21 July, Wed. 22 July, Thu. 23 July, Fri. 24 July); shown on: Thu. 23 July","FALSE","FALSE","FALSE","FALSE","TRUE","FALSE","TRUE"
"Thu. 23 July","Chai Dream","20:00","22:00","Laura / Shimmering by the forest edge","Arctic chill, grid square O06. In the Arctic Chill, close to Pamper Plaza, behind the camp ""Women who supports women""","Food/Drinks","🦍 Adults only","Come shimmer with us! As night chill creeps in, we're brewing warmth: Vegan spiced Chai with oat milk, plus nibbles on the side. Sing, cuddle, talk under the stars. All kinds of souls welcome! Bring your cup, your voice, just yourself. Let's get cozy by the fire!","","FALSE","FALSE","FALSE","TRUE","FALSE","FALSE","FALSE"
"Thu. 23 July","Tea by the Night","20:00","23:59","Tea by the Sea","Bison - South, grid square P23. The big red tent on the hill, by the Bison sculpture.","Party/Gathering","","Brew, breathe, and drift into the night. Let the fireplace, gentle melodies, and our homemade chai be your safe harbor until the stars take over.","","FALSE","FALSE","FALSE","FALSE","FALSE","FALSE","FALSE"
"Thu. 23 July","Sound Journey Ceremony","20:00","22:00","Sound Awakening Tribe & Friends / Temple of Sound","Eastern Slope, grid square V18.","Ritual/Ceremony","🦍 Adults only","Welcome to the Temple of Sound 🪐 Enter a sacred space of breath, healing sounds and powerful vibrations. Through gongs, didgeridoo, throat singing, drums, flutes and handpan, we will guide you through an immersive journey into altered states of consciousness. 🌌","Recurring: expanded to 4 days (Tue. 21 July, Wed. 22 July, Thu. 23 July, Fri. 24 July); shown on: Thu. 23 July","FALSE","FALSE","FALSE","TRUE","FALSE","FALSE","FALSE"
"Thu. 23 July","Wheel of Pleasure","20:00","22:00","The Fuckery","Swamp, grid square R17.","Games/Play","🦍 Adults only · 🖤 Sex positive","Welcome to The Wheel of Pleasure, where your yes is the only rule. Set your boundaries, choose your toys, don the blindfold, and let fate decide how many hands will deliver playful, teasing sensations across your body. You won’t know who. You won’t see them. You’ll only feel. Spin the wheel. 😈","Recurring: expanded to 3 days (Tue. 21 July, Wed. 22 July, Thu. 23 July); shown on: Thu. 23 July","FALSE","TRUE","FALSE","TRUE","FALSE","FALSE","FALSE"
"Thu. 23 July","Find Your Sapphic Soul Mate","20:00","22:00","Nyxie / The Sapphic Pond","Sunny Hills, grid square J21. Look for the lesbian flag, we fly it on a pole and spread it on the ground at the Pond, right by the Police Clown.","Games/Play","🌈🌈 Queer-focused","Opening-night magic: pin your heart to the Soul Matchmaking Board and let the Pond play cupid. We'll show you how it works, then set you loose to find your person (or your Tuesday-night U-Haul partner). Bring your crush energy 🐸💘","Recurring: expanded to 7 days (Mon. 20 July, Tue. 21 July, Wed. 22 July, Thu. 23 July, Fri.); shown on: Thu. 23 July","FALSE","FALSE","TRUE","FALSE","FALSE","FALSE","FALSE"
"Thu. 23 July","Blindfolded Non-verbal Slow Lesbian Dating","20:00","23:00","The Sapphic Frog / The Sapphic Pond","Sunny Hills, grid square J21. Look for the lesbian flag, we fly it on a pole and spread it on the ground at the Pond, right by the Police Clown.","Games/Play","🌈🌈 Queer-focused","Enter blindfolded, meet in the dark. A self-organized space for slow, non-verbal, consensual connection, no eyes, no words, no idea if she's flirting (she or they is). The cure for the lesbian sheep problem 🐑🐸","Recurring: expanded to 2 days (Thu. 23 July, Fri. 24 July); shown on: Thu. 23 July","FALSE","FALSE","TRUE","FALSE","FALSE","FALSE","FALSE"
"Thu. 23 July","Feeding the Myth by the Fire","20:00","22:00","Lila / The Wild Sacred Fire","Swamp, grid square S17. We'll be around the fire.","Workshop/Class","","Come travellers, witches and wizards: gather by the Wild Sacred Fire to enter myth through twilight. Together we become a threefold creature: story, teller and listener. Bring a story, a poem, or simply your listening — by the heat of the fire and a warm cup of cacao.","","FALSE","FALSE","FALSE","FALSE","FALSE","FALSE","FALSE"
"Thu. 23 July","Death Workshop","20:30","22:30","Jens / Tantric Trolls","Highlands, grid square N11. Penta Plaza","Workshop/Class","🦍 Adults only · 🌈 Queer-inclusive","When we face death, life becomes clearer. A reflective workshop for exploring mortality, uncovering core values, and asking what it truly means to live well.","","FALSE","FALSE","TRUE","TRUE","FALSE","FALSE","FALSE"
"Thu. 23 July","Michaladas Rojas at Salt Rock City","20:30","23:30","SALT ROCK CITY / The goslings","Wedge, grid square R21. Top right corner of The Wedge, bordering The Swamp and forest","Food/Drinks","","Michalada is a beer-based cocktail with tomato juice. It's awesome. There might also be crisps","","FALSE","FALSE","FALSE","FALSE","FALSE","FALSE","FALSE"
"Thu. 23 July","Cuddles & Live Jazz","21:00","0:00","Teddy Lind / Antra.world","Swamp, grid square T18. Once you hear cool jazz you’re close; find two large vans and an outdoor cuddle space and you’re there.","Music/Performance/Show","🦍 Adults only","Feeling cuddly, full of love and in the mood for live and laid back jazz? Come relax with like minded humans all in need for some rest and romance 💕","Recurring: expanded to 2 days (Wed. 22 July, Thu. 23 July); shown on: Thu. 23 July","FALSE","FALSE","FALSE","TRUE","FALSE","FALSE","FALSE"
"Thu. 23 July","Best DISCO in town","21:00","23:00","Pinkysha / Circus the Analog","Swamp, grid square S18. Huge circus tent","Music/Performance/Show","💥 Sensory content","Have you heard? The best Disco dance floor is back! Put on your sparkles and lets boogie!","","FALSE","FALSE","FALSE","FALSE","FALSE","TRUE","FALSE"
"Thu. 23 July","Hexology Magical Interactive Ceremony","21:00","2:00","Hexology","Lowlands, grid square R12. Look for the neon sign","Art/Installation","🐵 Kid-friendly · 💥 Sensory content","If you have the courage to come find our coven at night we will reward you with a special treat!  Only a few will experience our special magic ritual and learn how to cast spells.  Will it be you?  (We serve groups of 2-8 people for 15 to 30 minutes.  Kid Friendly!).","Recurring: expanded to 4 days (Tue. 21 July, Wed. 22 July, Thu. 23 July, Fri. 24 July); shown on: Thu. 23 July","TRUE","FALSE","FALSE","FALSE","FALSE","TRUE","FALSE"
"Thu. 23 July","Slutty Mermaid's Nipple Tingling Techno Net","21:00","4:00","Shibari Chill Web","Highlands, grid square M08. Deep in the throbbing woods","Party/Gathering","🦍 Adults only · 🌈 Queer-inclusive · 🖤 Sex positive · 🚨 Triggering themes · 💥 Sensory content","Non-ecstatic dance in the Shibari Chill Web. Not hanging models in ropes. Nothing naughty. Never cucumbers out. Especially no ones trousers stuck in seaweed. Never stare into someone's abyss. Not let jellyfish-bass tingle clitoris. Perky pearls get vip access. Octopussies welcome too.","","FALSE","TRUE","TRUE","TRUE","FALSE","TRUE","TRUE"
"Thu. 23 July","🙏 Borderland Cabaret Nite 2026- WE ARE NOT A CULT 🙏","21:00","23:30","You / Spaceport","Lowlands, grid square P12. Dome by the tall pink Temple, Lowlands","Music/Performance/Show","💥 Sensory content","🧞‍♂️👯‍♀️ Borderlings- gather together and seek no more! For on this very night we shall find the answers!

•⁠  ⁠9pm  🛸 Bring your art cars and mobile bars!
•⁠  ⁠945pm  🚀 Liftoff..
•⁠  ⁠1130pm 🔥 Universal Block Party - Gods, fire and lights

performers check in Weds 1pm and/or https://tinyurl.com/87utmrrz","","FALSE","FALSE","FALSE","FALSE","FALSE","TRUE","FALSE"
"Thu. 23 July","Theater of Desire","21:00","4:00","The Fuckers of the Fuckery / The Fuckery","Swamp, grid square R17. From the big empty field walk towards the fuckoff neon sign ""The Fuckery"" - just across the ditch in the swamp","Yoga/Movement/Bodywork","🦍 Adults only · 🌈 Queer-inclusive · 🖤 Sex positive","It is the launchpad for the Fuckery's Fantasy Fulfilment PlayNight. In this 1–1.5h workshop we take you through the basics and rules of the coming PlayNight — weirdos and weird rookies alike guided through information, games, exercises and action in Fuckery style, bringing out the best and worst in everyone. Come one, come all — share your dirty mind and join the exciting worlds of other seemingly normal human beings! If you come wearing socks, we'll blow them right off. Fucking Namaste.","","FALSE","TRUE","TRUE","TRUE","FALSE","FALSE","FALSE"
"Thu. 23 July","Open night by the fire","21:00","1:00","Camp Yggdrasil / Yggdrasil","Highlands, grid square O10. in the big Tipi","Party/Gathering","","Come, friend, and sit with us. Beneath the roots of the earth tree, we welcome you. Share your stories, warm yourself at our crackling fire and slow down for a while. You are welcome here. Just the way you are.🔥✨","","FALSE","FALSE","FALSE","FALSE","FALSE","FALSE","FALSE"
"Thu. 23 July","Fire Safety School","21:30","22:00","Fire Brigade / Fire Brigade","Swamp, grid square S16. In The Swamp at Fire Plaza, a gallery and red carpet area opposite the large tent of CIRCUS the ANALOG.","Workshop/Class","","A safety briefing for fire spinners who want to play at The Fire Brigade's fire jams or spin before the effigy. We will walk you through our safety protocol and give you a token of trust. Wear natural fabrics to play with fire (cotton, wool, linnen, leather).","Recurring: expanded to 3 days (Tue. 21 July, Wed. 22 July, Thu. 23 July); shown on: Thu. 23 July","FALSE","FALSE","FALSE","FALSE","FALSE","FALSE","FALSE"
