"Day","Title","Start","End","Facilitator/
Host camp","Location","Category","Vibes","Description","Comments","KID FRIENDLY","SEX POSITIVE","QUEER INCLUSIVE","ADULT ONLY","SOBER ONLY","Warning: Sensory content ","Warning: Triggering"
"Tue. 21 July","Sensual Biting","14:00","15:30","Shiny (they/them) / Njorunns Garden","Downtown, grid square M20. Dreamy garden in the middle of downtown, look for a big white tent.","Workshop/Class","🦍 Adults only · 😇 Sober · 🌈 Queer-inclusive · 🖤 Sex positive","> Explore biting as a love language of the body. Sexual or not, kinky or not, but always intimate.
> Experiment with techniques around the surprising variety of bites. Learn what kinds of bites you like to give and to receive.
> Come with a clean body, with a partner or find one there. Clothes stay on.","","FALSE","TRUE","TRUE","TRUE","TRUE","FALSE","FALSE"
"Tue. 21 July","Slut on a Stick Grand Championship","14:00","16:00","Plutonia","Downtown, grid square M19.","Music/Performance/Show","🦍 Adults only · 🌈 Queer-inclusive · 🖤 Sex positive","Ready to get slutty? Borderland's favorite pole, strip tease, and erotic dance competition is back. Whether you're competing for the crown of Slut Supreme or cheering from the sidelines, expect outrageous performances, roaring applause, and plenty of glitter, glamour, and glorious chaos.

Interested in competing? We'd love to have you! Reach out to @ruby.xo, @dominika0198, or @erindepew on Discord to sign up if space allows.","","FALSE","TRUE","TRUE","TRUE","FALSE","FALSE","FALSE"
"Tue. 21 July","The Latex Strut Your Stuff Party Walk & Tumble","14:00","19:00","Rest & Revelry","Eastern Slope, grid square W15.","Games/Play","🦍 Adults only · 🌈 Queer-inclusive · 🖤 Sex positive","Do you have a certain dark, physical desire? Does it spell LATEX? Heck yes - we've got an event for you! Dress up or down in your finest black, and join us at Rest & Revelry for a swaggering tour around the playa. Let's strut our stuff, let's show others how to be spankalicious and sparkling in black. What, where, and how it ends? Come find out....","","FALSE","TRUE","TRUE","TRUE","FALSE","FALSE","FALSE"
"Tue. 21 July","Exhibitionism for beginners","14:00","15:30","Erik H / Sacret Kink","Swamp, grid square R18. Sacret Kink is close to Water Plaza (Swamp neighbourhood)","Workshop/Class","🦍 Adults only · 😇 Sober · 🖤 Sex positive","Feeling curious about letting others consensually and actively watch you be intimate? We’ll set the stage! In this workshop (after some warmup and boundry talk) we’ll take turns being in the middle while being watched by the rest of the group. Come with a partner or a group to touch/make out/be sensual with. No full nudity, to keep it more inclusive for beginners, no experience needed.","","FALSE","TRUE","FALSE","TRUE","TRUE","FALSE","FALSE"
"Tue. 21 July","Argentinian Tango","14:00","15:00","Raul / Secret sailors","Lowlands, grid square R12.","Workshop/Class","🐵 Kid-friendly · 🌈 Queer-inclusive","Experience Argentine tango – an intimate dialogue through movement, connection, and music. Together we explore the fundamentals of this beautiful dance, guided by the timeless sounds of traditional tango. As this recurring event unfolds, each session will build naturally on the last, allowing us to gradually deepen our understanding and expression.","Recurring: expanded to 6 days (Mon. 20 July, Tue. 21 July, Wed. 22 July, Thu. 23 July, Fri.); shown on: Tue. 21 July","TRUE","FALSE","TRUE","FALSE","FALSE","FALSE","FALSE"
"Tue. 21 July","Let’s Tango!","14:00","15:00","Raulito / Secret Sailors","Lowlands, grid square R12. Secret Sailors tent by Lowlands plaza","Workshop/Class","","Come and dance tango together! Learn the basics, grab a partner and feel the heat!","Recurring: expanded to 5 days (Mon. 20 July, Tue. 21 July, Wed. 22 July, Thu. 23 July, Fri.); shown on: Tue. 21 July","FALSE","FALSE","FALSE","FALSE","FALSE","FALSE","FALSE"
"Tue. 21 July","Latin Paint Jam","14:00","15:30","Allan / Spaceport","Lowlands, grid square P12. Dome by the tall pink temple, Lowlands","Crafting/Pimping/Arting","🌈 Queer-inclusive","A spontaneous, low-pressure creative space where everyone is invited to paint together while Latin music fills the air. There are no instructors, no themes, and no expectations! Just brushes, colors, rhythms, and people creating side by side.","","FALSE","FALSE","TRUE","FALSE","FALSE","FALSE","FALSE"
"Tue. 21 July","Toki Pona Tuesday","14:00","18:00","jan Wajole / Sunsprout☀️🌱","Swamp, grid square U18.","Party/Gathering","🌈 Queer-inclusive","Toki Pona is a minimalist language that explores simplicity, communication, and new ways of thinking. Whether you're fluent, learning, or curious, come chat, ask questions, share knowledge, or simply listen and hang out.
I'd love to meet new people and share this pona language with!

o kama musi toki!","","FALSE","FALSE","TRUE","FALSE","FALSE","FALSE","FALSE"
"Tue. 21 July","Tantric Primal Play","14:00","16:00","Henrik and Maria / Tantric Trolls","Highlands, grid square N11. Highlands","Workshop/Class","🦍 Adults only · 🖤 Sex positive","Your body has been waiting for this workshop.
Tantric Primal Play is about contact, play, and presence. A place for your inner animal to take the scene. On all fours we meet, in real freedom, real vulnerability, embodied safety and consensual fun.","Recurring: expanded to 2 days (Tue. 21 July, Thu. 23 July); shown on: Tue. 21 July","FALSE","TRUE","FALSE","TRUE","FALSE","FALSE","FALSE"
"Tue. 21 July","Afternoon boba bubbles","14:00","16:00","Tea By The Sea","Bison - South, grid square P23. Tea by the sea is located next to the lookout the big red roofed tea house next to Metal Bison","Food/Drinks","","Sunny popping mango boba tea, served with mellow groovy music. bring your own cup. We provide the straws.","","FALSE","FALSE","FALSE","FALSE","FALSE","FALSE","FALSE"
"Tue. 21 July","The Naughty Improv Theater - by the Fuckery","14:00","15:30","Discolinski (DJ Räjfvhaal) / The Fuckery","Swamp, grid square R17. Look for the big, red neon sign next to the Missing Piece.","Workshop/Class","🦍 Adults only · 🖤 Sex positive","A workshop and performance space exploring erotic storytelling, playful roleplay and spontaneous physical comedy through the liberating lens of improv theatre. No rehearsals, no shame, no bad ideas (only offers). Classic improv exercises — with a raunchy twist. You don't need to be sexy, just show up, say yes, and make a fool of yourself magnificently. Dress (or undress!) in a way that brings out your sexiest you.","","FALSE","TRUE","FALSE","TRUE","FALSE","FALSE","FALSE"
"Tue. 21 July","SALT ROCK CITY - A Salt Journey and Other Voodoos","14:00","16:00","The Salt Girls (and boys) / The Goslings","Wedge, grid square R21. Find us at the Cuddle Cove plaza in the Wedge!","Food/Drinks","","SALT ROCK CITY is here to provide for all your salty needs!
Today we invite you to find whatever voodoo your salty soul requires. Non-salty demons are also welcome. 
Expect a journey through our unique salt tasting experience, experimental snacking, refreshing electro-mock/cocktails and much more!","","FALSE","FALSE","FALSE","FALSE","FALSE","FALSE","FALSE"
"Tue. 21 July","Philosophical Foot Massage","14:00","15:30","Merlin Ratio / ❤️ The Heart ❤️","Highlands, grid square M11. The Camp The Heart is directly at the Penta plaza in the Highlands. Ask for Merlin in the Camp. Exact location in the Heart Camp is still not defined, but most likely in Merlin's big tent","Yoga/Movement/Bodywork","🦍 Adults only · 😇 Sober","Where touch meets curiosity. What if a foot massage could become a conversation without words? Working in pairs, you'll be guided through playful invitations that transform a simple foot massage into an unexpected journey of connection — conscious touch, playful philosophical prompts, and a nine-step reflection journey that may inspire new perspectives on your path. Not about technique or sensuality — about attention. No experience needed; every exercise is optional and based on enthusiastic consent. Bring a small towel and your own massage oil if you like. Come with clean feet, an open mind and a willingness to be surprised.","","FALSE","FALSE","FALSE","TRUE","TRUE","FALSE","FALSE"
"Tue. 21 July","Bachata Sensual - Energy Play","14:00","16:00","Sajuran & Linsey / ❤️ The Heart ❤️","Highlands, grid square M11. Look out for the flag with the big heart on it!","Yoga/Movement/Bodywork","🦍 Adults only","Connection begins before the first step. In this workshop, we explore partner dance through body awareness and shared breath. You’ll learn how intention shapes motion—where leading invites and following responds.

You’ll cover Bachata Sensual and a simple flowing figure to apply them. Open to beginners and experienced dancers alike, it’s a playful, grounded space to deepen connection and enjoy movement that feels as good as it looks.","","FALSE","FALSE","FALSE","TRUE","FALSE","FALSE","FALSE"
"Tue. 21 July","Sacred Butthole Moulding","14:00","16:00","Peter & Clara / The Observatory","Swamp, grid square Q19.","Crafting/Pimping/Arting","🖤 Sex positive · 🦍 Adults only","How intimately do you know your body? Do you even know what your butthole looks like? Do you yearn for a way to parade it around the festival and all social settings? YES! We will help you create a mold of your butthole and then turn it into a necklace pendant. Get familiar with your other opening!","","FALSE","TRUE","FALSE","TRUE","FALSE","FALSE","FALSE"
"Tue. 21 July","🏳️‍🌈 HO(mo)-ROX: A RACE EXTRAVAGANZA","14:00","16:00","The Seagulls Nest","Highlands, grid square O11. Look for the lighthouse","Games/Play","🦍 Adults only · 🌈 Queer-inclusive","A HYROX-inspired workout will create new heated rivalries on the Playa. Come join us for exercise, fun, and cum-petition. Please arrive on time.","","FALSE","FALSE","TRUE","TRUE","FALSE","FALSE","FALSE"
"Tue. 21 July","Step Up: A Men’s Workshop on Safer Spaces","14:00","15:30","Sleepy Lieutenant and the Low Effort Leftover Crew / The Source","Lowlands, grid square S12. East of Lowlands Plaza, 2nd camp once you turn East","Workshop/Class","😇 Sober · 🚨 Triggering themes","Some women in our community see up to 80% of men as potential threats. That should stop you in your tracks. We are opening up a space for men to discuss and exchange the gap  between “I’m a good guy” and how we actually show up — and leave with real tools, not guilt.","","FALSE","FALSE","FALSE","FALSE","TRUE","FALSE","TRUE"
"Tue. 21 July","Craft a  Loppa and Sweet Dreamcatchers","14:00","16:00","The Sweet Spot / The Sweet Spot","Lowlands, grid square P13. White with red decorations. Follow the glorious smell of pancakes.","Crafting/Pimping/Arting","","Craft paper fortune tellers and dream catchers with the Sweet Spot!
Coming to Borderland for the first time ever: ✨ Sweet Spot Crafting!✨ 
We are expanding our cozy vibes this year by offering a crafting space connected to our beloved pancake café. Come and craft paper fortune tellers (loppa!) and dream catchers with us!","","FALSE","FALSE","FALSE","FALSE","FALSE","FALSE","FALSE"
"Tue. 21 July","Pancake Blinddate","14:00","16:00","The Sweet Spot / The Sweet Spot","Lowlands, grid square P13. White with red decorations. Follow the glorious smell of pancakes.","Food/Drinks","🦍 Adults only · 🌈 Queer-inclusive","Find your love over pancakes. You'll be blindfolded and share one of BL's best meals with a to-be life-partner: no faces, no assumptions, just two people and pancakes. When the meal ends, you'll each be asked the same question: do you want to see them? If both say yes, the blindfolds come off and a new story begins. If not, you part as strangers. Clothed event.","","FALSE","FALSE","TRUE","TRUE","FALSE","FALSE","FALSE"
"Tue. 21 July","Tahini bucket opening ceremony","14:00","15:00","The Tahinians","Lowlands, grid square Q12.","Food/Drinks","🐵 Kid-friendly","The Tahini goddess herself invites you to this spectacular ceremony where we will open the BIG bucket. There will be Tahini songs, Tahini blessings, Tahini fika and so much Tahini. Please come and join the one true faith that is Tahini!","","TRUE","FALSE","FALSE","FALSE","FALSE","FALSE","FALSE"
"Tue. 21 July","🚀 Embodied Futuring Lab","14:00","16:00","BeRiver & Omi-peah / Touch Divine","Wedge, grid square R22.","Workshop/Class","🌈 Queer-inclusive","This is a creative session in which we practice surrendering control and allowing ourselves to drop into group consciousness. We start by grounding into our bodies and co-regulating our nervous systems to come into a state of flow. Through a playful and open dialogue, visualizations and embodied practices we then embark on a journey into the future.","","FALSE","FALSE","TRUE","FALSE","FALSE","FALSE","FALSE"
"Tue. 21 July","Battle Yoga or Yoga Battle (Silly)","14:00","15:00","Astrid / Welcome Home, Darling","Highlands, grid square O10. Between Penta Plaza and Bayt al-Noor","Yoga/Movement/Bodywork","🌈 Queer-inclusive","Ever wanted to battle Beige Becky who just does everything perfectly? Or Lars in his Lululemons? In groups we explore which yoga poses we can do, and then we battle each other on speed, finesse and style. NO EXPERIENCE WITH YOGA NEEDED. Come as you are. This is not serious yoga, and all are welcome!","","FALSE","FALSE","TRUE","FALSE","FALSE","FALSE","FALSE"
"Tue. 21 July","Alversjö community talk","14:00","15:00","Alversjö members","K19. Barn patio, Down town","Workshop/Class","😇 Sober","Come and talk about the all year round community in Alversjö, the history and ideas for the future. What do we do here outside of Borderland and how does things work? Come ask your questions and find out how you can engage.","Recurring: expanded to 2 days (Tue. 21 July, Sat. 25 July); shown on: Tue. 21 July","FALSE","FALSE","FALSE","FALSE","TRUE","FALSE","FALSE"
"Tue. 21 July","Flow Session: Play Lab","14:15","15:45","Timmy / Flowzone monkeybar","Highlands, grid square M11. Highlands, Penta plaza (big flag) next to Chilldome","Yoga/Movement/Bodywork","😇 Sober","A collaborative movement lab where we explore, invent, and prototype games for the climbing rig. Through playful warm-ups, creative prompts, and experimentation, we’ll discover what emerges—then finish with an open flow jam. Curiosity over perfection.","","FALSE","FALSE","FALSE","FALSE","TRUE","FALSE","FALSE"
"Tue. 21 July","The Black and White Rolling Ceremony","14:20","16:20","He Whom The Smoke Is Circling / Where The Craving Is Settled","When walking in the direction of the sun, at the end you find a haven for those that know the secrets of the Herb","Workshop/Class","🦍 Adults only","Those that know the secrets of rolling, and those that seeks the knowledge of the Role. Those that are curious about the rituals aorund the Herbs and those that know the meaing of the hand gestures. Those that have sat in the circle and those that are seeking the circle. Those whom have been both passanger and conductors of the train.","Recurring: expanded to 4 days (Tue. 21 July, Wed. 22 July, Thu. 23 July, Sat. 25 July); shown on: Tue. 21 July","FALSE","FALSE","FALSE","TRUE","FALSE","FALSE","FALSE"
"Tue. 21 July","Afternoon Beats & Mango Sour Beer","14:30","17:30","The Pink Parasol Potion Bar / The Herd","Highlands, grid square O10.","Food/Drinks","","Welcome to The Herd! We dance in the afternoon calm (Tue-Thu, 14:30–17:30). Join the pack for daylight grooves, great company, and a refreshing cup of our home-brewed mango-lemon sour beer from The Pink Parasol Potion Bar! 🥭⛱️🔮","Recurring: expanded to 3 days (Tue. 21 July, Wed. 22 July, Thu. 23 July); shown on: Tue. 21 July","FALSE","FALSE","FALSE","FALSE","FALSE","FALSE","FALSE"
"Tue. 21 July","Pimp your hat workshop","15:00","17:00","Odinka / Alice the Malice in Wonderland","Wedge, grid square R20.","Crafting/Pimping/Arting","🐵 Kid-friendly","Bring your fabulous hat, tiny treasures you'd like to attach to it, fabric scraps, and all your sparkly bits, and come pimp your hat at Alice the Malice!

Get ready for your burn and the Mad Hatter Tea Party on Thursday. ✨","","TRUE","FALSE","FALSE","FALSE","FALSE","FALSE","FALSE"
"Tue. 21 July","ACA 12 STEPS MEETING","15:00","16:00","All Sense No Sense","Eastern Slope, grid square W16. The meeting is in the Tipi tent at Camp All Sense No Sense. Look for ACA sign. 
The camp is placed between ""Camp YES"" and ""CINEMA PIZZAISO","Workshop/Class","😇 Sober","Open meeting for adult children of alcoholic and dysfunctional families. (ACA). We do some reading and share about your own experience, strength, and hope. Everyone is welcome!","Recurring: expanded to 2 days (Tue. 21 July, Thu. 23 July); shown on: Tue. 21 July","FALSE","FALSE","FALSE","FALSE","TRUE","FALSE","FALSE"
"Tue. 21 July","Shame alchemy with helium","15:00","16:30","Tiia & Helena / Beaver Issues","Arctic chill, grid square P07. Look for the beaver sign and stretch tent!","Workshop/Class","🦍 Adults only","Alchemising shame with the lightness of inhaled helium.
No need to prepare in advance in any way, you and your shame are welcome as you are!
Facilitated and space held by Tiia & Helena.","","FALSE","FALSE","FALSE","TRUE","FALSE","FALSE","FALSE"
"Tue. 21 July","The Baby Badgers: Blackwater Youth Corps","15:00","16:30","Senator Snowflake and Cpt Gypsy / Blackwater Operations","Lowlands, grid square P09. Kidsville, in front of Workshop Dome.","Workshop/Class","🐵 Kid-friendly","Parents: your kid deserves better than a boring hula-hoop workshop. The Baby Badgers Youth Corps offers one afternoon of real military training: tactical face paint, spy craft, reconnaissance and obstacle course. They'll come home braver, stronger and ready to win in life. Limited spots. Go Badgers, go! #freedomdontcomefree","","TRUE","FALSE","FALSE","FALSE","FALSE","FALSE","FALSE"
"Tue. 21 July","House of SIN: The Art of Undressing","15:00","16:00","Teddy / Club SIN","Bison - North, grid square N19. By the Shameless Plaza","Workshop/Class","🦍 Adults only · 🖤 Sex positive","Undressing can be more than simply taking clothes off—it can become a playful, sensual, and connecting experience. In this workshop, you'll explore presence, anticipation, and curiosity through guided exercises that build confidence, deepen connection, and inspire new ways to begin intimacy.","","FALSE","TRUE","FALSE","TRUE","FALSE","FALSE","FALSE"
"Tue. 21 July","5 types of dance, 20 minutes, let's go","15:00","15:30","Egil / DansBanderLand","Swamp, grid square T19. The LED dansbana (= pavilion)","Workshop/Class","","For 20 minutes, we dance through 5 kinds of dance: ring dance, moving to couples', then solo, mosh pit, basic choreographed, and finally ring dance again. The tempo will be high and participants are not expected to have previous experience in any of the dances.","","FALSE","FALSE","FALSE","FALSE","FALSE","FALSE","FALSE"
"Tue. 21 July","Speed Dating","15:00","16:30","Sandra / GlitterTind","Bison - North, grid square O20. Shameless plaza next to sinnergirl","Games/Play","🦍 Adults only · 🌈 Queer-inclusive","Speed dating/speed connection: exciting and interesting questions to ask and answer, and food served! Part of our Sausage Social Party. 🌭","","FALSE","FALSE","TRUE","TRUE","FALSE","FALSE","FALSE"
"Tue. 21 July","LOOKING FOR MY FUTURE BABY DADDY","15:00","18:00","Cecilie / Keepers of Le Observable Universe","Highlands, grid square L10. The camp is in the far west of the Highlands. I will wear a T-shirt saying ""LOOKING FOR MY FUTURE BABY DADDY""","Weird shit/Other","🦍 Adults only · 😇 Sober · 🌈 Queer-inclusive","Come for a speed interview for the highly competitive position as my future baby daddy.
Dream candidate: Wants 1-2 kids in 3-4 years, vegan/veg, caring, present, emotionally mature, a lil weird, cat person.
I'm 36, cute, bi/pan, non-monogamous, vegan, sober, creative, in CPH and I published a novel!","","FALSE","FALSE","TRUE","TRUE","TRUE","FALSE","FALSE"
"Tue. 21 July","Cloud watching","15:00","17:00","Lazy camp","Bison - North, grid square P22. Inside a 10m diameter dome","Games/Play","🐵 Kid-friendly","Lay back, relax, and let your imagination fly, it’s cloud watching time! Spot dragons, donuts, dancing llamas. Who knows what floats by? Bring your wildest daydreams, and some chill vibes. No rules, no rush, just sky-gazing joy and fluffy fun above.","Recurring: expanded to 6 days (Mon. 20 July, Tue. 21 July, Wed. 22 July, Thu. 23 July, Fri.); shown on: Tue. 21 July","TRUE","FALSE","FALSE","FALSE","FALSE","FALSE","FALSE"
"Tue. 21 July","LEAVE YOUR TRACE IN A BALANCED SPACE","15:00","18:00","MŸS Dome","Swamp, grid square T16. Wooden Dome, near Fire Brigade","Art/Installation","🐵 Kid-friendly","Every piece of MOOP is looking for its destiny — bring yours! The lonely bottle cap, the mysterious plastic thing nobody can identify. Bring a piece of MOOP, ideally not bigger than your hand nor heavier than your soul. Together we'll transform forgotten leftovers into curious creatures and cosmic artifacts for a floating mobile. Weird, beautiful, silly, impossible — no skills required. Help bring the universe back into balance. Or at least make it wobble more interestingly.","","TRUE","FALSE","FALSE","FALSE","FALSE","FALSE","FALSE"
"Tue. 21 July","Meet the Queers","15:00","16:30","Rosa & Lisa / Pink Parachute","Lowlands, grid square P13. Velvet Loung behind Pink Parachute, if you dont find us, ask at the bar","Party/Gathering","🌈🌈 Queer-focused · 🐵 Kid-friendly","Queers of the Borderland unite. Let's meet each other over a delicious (vegan) soft serve ice-cream and connet. Because its nice to know who your rainbow siblings are! An easy mostly informal hangout with a name round, an opportunity to be joyously gay and to plot the Queer Take Over ;)","","TRUE","FALSE","TRUE","FALSE","FALSE","FALSE","FALSE"
"Tue. 21 July","Hospice in the Anthropocene - How to live with climate grief","15:00","16:00","Ultramarine / Secret Garden","Downtown, grid square M21. Workshop space at Secret Garden","Workshop/Class","🌈 Queer-inclusive · 🚨 Triggering themes","A workshop focused on Hospice in the Anthropocene - how can we help each other cope with Solastalgia, the grief or emotional loss from living in a degraded or dying ecosystems and societies? 

The focus is a facilitaded self-help group to share thoughts and feelings from living through difficult times, and climate angst for the future and coping mechanism.","","FALSE","FALSE","TRUE","FALSE","FALSE","FALSE","TRUE"
"Tue. 21 July","Let's create Burner AI Cyberpunk Utopia Workshop","15:00","16:00","Nicola / The Wracked Yachtees Asylum","Eastern Slope, grid square V16. In the Yachtees Magic Offerings area on the Eastern Slope, between The Wrecked Yachtees Asylum and Linda Land. It's just east of The Brothel and immediately south of the main road through the camping area next to Camp YES!","Workshop/Class","","Let's stick our neurons together to draft a bold and peaceful vision of an utopia we all would like to live in. We will split into groups to develop our AI cyberpunk utopia in different domains of life, from democracy, housing, community, security and (maybe) more. This is where creative thinkers are supposed to meet AI tech nerds 🤖✌️","","FALSE","FALSE","FALSE","FALSE","FALSE","FALSE","FALSE"
"Tue. 21 July","Squeeze Me 🍊","15:00","17:00","Under pressure","Swamp, grid square R19. We are orange","Food/Drinks","🐵 Kid-friendly","Come squeeze yourself a glass of orange juice - you never know where it might take you. 🍊","Recurring: expanded to 2 days (Tue. 21 July, Thu. 23 July); shown on: Tue. 21 July","TRUE","FALSE","FALSE","FALSE","FALSE","FALSE","FALSE"
"Tue. 21 July","Un-shaming with somatic therapy (Women only)","15:00","16:30","Izel / Women who support women","Arctic chill, grid square O06. take the path on the right from pamper plaza, we are at the corner of the next turn","Workshop/Class","😇 Sober","Come as you are and leave as a woman more conscious of the stories you have been told around your body and your sensuality. Get a taste of what somatic therapy can do for you to be more in the body and to feel more of all the fullness life has to offer.","","FALSE","FALSE","FALSE","FALSE","TRUE","FALSE","FALSE"
"Tue. 21 July","Tree Of Life Dreamcatcher Workshop","15:00","16:30","Marie / Yggdrasil","Highlands, grid square O10. in the big Tipi","Workshop/Class","🐵 Kid-friendly","Come to the tipi to create your own Tree of Life dreakcatcher necklace and share thoughts along it !","","TRUE","FALSE","FALSE","FALSE","FALSE","FALSE","FALSE"
"Tue. 21 July","Body Music Co-Composition (Amir/Here)","15:03","16:04","Here / SINagogue","Downtown, grid square K21. Under the church - Ask about Here at the SINagogue","Workshop/Class","","Your body is a wonderful music instrument with a lot of untapped musical potential. We'll hear and learn notes, melodies, beats and sounds made by human bodies. Pretty sure at least some of them will be completely new to you. Depending on the group, we'll hopefully end up jamming and co-composing something unforgettable.","Recurring: expanded to 2 days (Sun. 19 July (build), Tue. 21 July); shown on: Tue. 21 July","FALSE","FALSE","FALSE","FALSE","FALSE","FALSE","FALSE"
