"Day","Title","Start","End","Facilitator/
Host camp","Location","Category","Vibes","Description","Comments","KID FRIENDLY","SEX POSITIVE","QUEER INCLUSIVE","ADULT ONLY","SOBER ONLY","Warning: Sensory content ","Warning: Triggering"
"Wed. 22 July","Pink Parachute Clown Games: Don't play* to win. Play to play.","15:00","16:30","Yonatan / Pink Parachute","Lowlands, grid square P13.","Games/Play","🐵 Kid-friendly","Clown games are easy, silly and absurdly fun. No winners, no losers, no audience. No any experience, talent or equipment needed. Just a willingness to play games and have fun!

No physical contact required.

Clothing &  Sobriety optional.

*Not that kind of play, you pervert.","","TRUE","FALSE","FALSE","FALSE","FALSE","FALSE","FALSE"
"Wed. 22 July","Cunty BBQ","15:00","17:00","Serving Cunts","Lowlands, grid square R11. South of snackplaza, by Fox Hole Camper Vans","Food/Drinks","🐵 Kid-friendly","Some follow the music. Others follow the smoke. Wander into the Low Lands, just south of Snack Plaza, where glowing coals, happy bellies, and friendly faces await. We grill with heart, season with joy, and serve questionable grill-master jokes free of charge.","Recurring: expanded to 2 days (Wed. 22 July, Thu. 23 July); shown on: Wed. 22 July","TRUE","FALSE","FALSE","FALSE","FALSE","FALSE","FALSE"
"Wed. 22 July","Weird body sound competition","15:00","18:00","Valborg / Silly Sanctuary / Silly sanctuary","Swamp, grid square S20.","Games/Play","💥 Sensory content","Wanna show off your noisy party tricks? Can you whistle through your front teeth? Make really loud farts with your knees? Are you the Queen of queefs? Valborg of Silly Sanctuary will be the judge!","","FALSE","FALSE","FALSE","FALSE","FALSE","TRUE","FALSE"
"Wed. 22 July","The Pre-Game Ritual","15:00","19:00","Tahinians","Lowlands, grid square Q12. Look for the big yellow bus and 50 shades of tahina beige","Food/Drinks","🌈 Queer-inclusive","We have all been there: the best part of the night was the pre-game. The anticipation through the roof, sparkling wine flowing, skirts on and off hunting for the perfect outfit, crowding the mirrors smudging rainbows on each other's faces, glitter everywhere (bio, of course). That perfect tipsy trance you only reach with the bestest of friends. We, the Tahinians, welcome you to an event where the WHOLE party is the pre-game. The party never stops because it never begins — so it's... forever? We bring the glam, mirrors, sparkling wine and vibes ❤","","FALSE","FALSE","TRUE","FALSE","FALSE","FALSE","FALSE"
"Wed. 22 July","Hattifnatti Sauna Hat Workshop","15:00","17:00","Rose / Tea by the Sea","Bison - South, grid square Q23.","Workshop/Class","🐵 Kid-friendly · 😇 Sober","Make your own wooly sauna hat! Rose guides you through the wet art of felting where, after hard work and patience, you walk out with a hat truly made with love. No experience needed. Level up your sauna game! 8 spots, and bringing a friend to co-create a hat with is always magic! Bring a towel!","","TRUE","FALSE","FALSE","FALSE","TRUE","FALSE","FALSE"
"Wed. 22 July","DUB & DRINKS","15:00","18:00","The Bears / The Bear's Den","Sunny Hills, grid square H19. Turn between The Grateful Grogg and Discotech Engineering, then head for the tent by the edge of the forest.","Music/Performance/Show","","The Bear takes it slow. Join us for an afternoon of dub reggae in the sun. Warm bass, cold drinks and deep sounds on our hand-crafted sound system. Mellow out and sip on drinks from the bears and friends.","","FALSE","FALSE","FALSE","FALSE","FALSE","FALSE","FALSE"
"Wed. 22 July","Body paint: Release your inner creature (session #1 - early)","15:00","17:00","Ea and The Bubbles / The Bubbles","Highlands, grid square N11. Cheeky Butt Chill Camp","Crafting/Pimping/Arting","🌈 Queer-inclusive","A soft, playful invitation to connect with your inner creature and meet fellow creatures through the art of body painting. We’ll use color, creativity, and consensual touch to celebrate the beauty of diverse bodies, and rediscover the freedom of creating and connecting through play.

You will either be the canvas or the artist. You can have just a part of your body or face painted, or your entire body. The amount of clothing you choose to wear is entirely up to you.","","FALSE","FALSE","TRUE","FALSE","FALSE","FALSE","FALSE"
"Wed. 22 July","The Spy Bar","15:00","18:00","Camp: Nothing Suspicious Here / The Grateful Grogg","Sunny Hills, grid square I20.","Food/Drinks","🦍 Adults only","The Spy Bar is a top secret operation disguised as a bar, or maybe the other way around. Either way, you’re already being watched.

If you make it through security, you might make it to the bar. Drinks are classified.

If someone calls you Agent, just go with it. If someone calls you infiltrator, run.","","FALSE","FALSE","FALSE","TRUE","FALSE","FALSE","FALSE"
"Wed. 22 July","<3 Connect. Ground. Feel. The Heart Sharing Circle <3","15:00","16:30","Pudding / ❤️ The Heart ❤️","Highlands, grid square M11. Look out for the flag with the big heart on it!","Yoga/Movement/Bodywork","😇 Sober · 🦍 Adults only","Join The Heart for a moment of slowness and reflection. This will be a facilitated circle, where everyone gets the opportunity to become still, to witness self and others, and to share whatever is moving inside. No WooWoo, just genuine humanness. Please be sober.","","FALSE","FALSE","FALSE","TRUE","TRUE","FALSE","FALSE"
"Wed. 22 July","Soul Alchemy - a Rite of Passage for Heart Activists","15:00","17:30","Feli / The Heartspace","Arctic chill, grid square P07.","Workshop/Class","🦍 Adults only · 😇 Sober · 🚨 Triggering themes","A guided journey from personality > soul > spirit, meeting our soul current and rewiring whence service flows: from sacrifice to overflowing cup. By cracking our heart open to what truly matters, real purpose emerges. Advanced: requires holding your emotions and meeting another as a pure mirror.","","FALSE","FALSE","FALSE","TRUE","TRUE","FALSE","TRUE"
"Wed. 22 July","The Mothership Takeoff","15:00","6:00","The Mothership","Downtown, grid square L18. The Containerpark Launchpad (next to Plutonia)","Party/Gathering","","Welcome to The Mothership Takeoff.
This is our one and only departure.

The Containerpark Launchpad will be used only on this day.
Travellers access midday, under the warming sun.
Bring your curious playful self, we want you onboard.

Celebrate the wonders of life on earth, dance and connect.
As the sun sets, we gather close to launch our energy into space.
Expect a journey far far away, until reunited with the rising sun.","","FALSE","FALSE","FALSE","FALSE","FALSE","FALSE","FALSE"
"Wed. 22 July","Practical exploration of Dom-/Subspace","15:00","16:30","Rasmus and Sonja / The Source","Lowlands, grid square S12.","Workshop/Class","🦍 Adults only · 🌈 Queer-inclusive","Do you want to explore more about how to enter dominant/submissive space on both an internal and relational level? Perfect for both newbies and old-timers wanting to get a deeper understanding of how to get to, remain in, and enjoy power play, or just to have fun in a safe space. No partner needed.","","FALSE","FALSE","TRUE","TRUE","FALSE","FALSE","FALSE"
"Wed. 22 July","Slutty Mary's","15:00","17:00","Cecilia and Kerry","Follow the sound of hushed gossip, sharp gasps, and the relentless clink-clink of the Shame Bell.","Food/Drinks","","Confess sins, spill gossip and spread scandal in exchange for Bloody Marys at this hangover haven hosted by unholy sisters in honour of the saint of questionable decisions and unbelievable excuses. Better start sinning; the masses are thirsty.","","FALSE","FALSE","FALSE","FALSE","FALSE","FALSE","FALSE"
"Wed. 22 July","Purifying Sweat Ceremony","15:00","18:00","Kalle Grill, Anna Jois","The Sacred Fire","Ritual/Ceremony","😇 Sober · 💥 Sensory content · 🚨 Triggering themes","A facilitated purification ceremony in the lodge, in darkness, heated by stones from the fire. Four rounds cover body, emotions, thoughts, and the basic conditions of our existence. Join to let go, to transform, to shift perspective, to be born again.","","FALSE","FALSE","FALSE","FALSE","TRUE","TRUE","TRUE"
"Wed. 22 July","House of SIN: Spank You Very Much!","15:30","17:00","Amadeus & KinkyWowWow / Club SIN","Bison - North, grid square N19. By the Shameless Plaza","Workshop/Class","🦍 Adults only · 🖤 Sex positive · 💥 Sensory content","Hands, paddles, canes and whips. Learn how to use them to create sensations that mix pleasure and pain on your skin. We will cover basic techniques, communication and use different tools to leave your skin tingling and bodies craving more. Impact tools will be provided, but you can also bring your own.","","FALSE","TRUE","FALSE","TRUE","FALSE","TRUE","FALSE"
"Wed. 22 July","Hobbyhorse Creation","15:30","17:30","Akut / Kidsville","Lowlands, grid square P09.","Crafting/Pimping/Arting","🐵 Kid-friendly","Let's create a hobby horse together. Create your mare of dare or your stallion of batallion!  Material and tools are on premises. You can use your creation for Thursday's hobbyhorse contest.","","TRUE","FALSE","FALSE","FALSE","FALSE","FALSE","FALSE"
"Wed. 22 July","The Wheel of consent","15:30","16:30","Laura / The Church","Downtown, grid square K21. The Church, Downtown","Workshop/Class","🦍 Adults only · 🖤 Sex positive","Workshop with the Wheel of consent. Experience consent through play and foster sensibility for the different modes of desire.","","FALSE","TRUE","FALSE","TRUE","FALSE","FALSE","FALSE"
"Wed. 22 July","📀 Italo Euro Disco 📀","15:59","17:00","Foyaé Villa Hutlös","Eastern Slope, grid square V17. Not far from where shibari-chill-web was last year. A camp with a pavilion tent and a wooden dome.","Party/Gathering","","Min chéri! Too much techno minimale is melting your hjärna, no? Mi amor, being cool all the time is deprimente. Basta! Kom dansa och be dumbom with os. Meine Liebe we vill stjäla your dans moves and hear you zingen out lout in the language of amore (danish?).","","FALSE","FALSE","FALSE","FALSE","FALSE","FALSE","FALSE"
"Wed. 22 July","Myrkveil: Sensual Healing Massage - Restoring trust between Masculine & Feminine","16:00","23:00","BabyPickles / All Senses, No Sense - East slope","grid square X16. There will be a sign at the road saying Camp All Senses, No sense - At the back of the camp towards the tree line, towards Trancedental Forest Temple.","Workshop/Class","🦍 Adults only · 😇 Sober","BOOKINGS > Primarily for women, but all are welcome. A safe, consent-led journey into trust, sensation & release through sensual massage, breath, music & energy work. Held by grounded masculine presence, with care & without ulterior motives. Intimate, but NEVER sexual. More INFO & BOOKING @ CAMP.","","FALSE","FALSE","FALSE","TRUE","TRUE","FALSE","FALSE"
"Wed. 22 July","Sherlock is your guide","16:00","17:00","Sherlock / B.L.U.E Bureau","Highlands, grid square N09.","Weird shit/Other","🌈 Queer-inclusive","An interactive tour around the playa  while learning detective skills. Following suspects, interrogating witnesses, examining crime scenes, we'll do it all.
We'll leave 16:10, try to be on time or your first detective case will be to find the group.","","FALSE","FALSE","TRUE","FALSE","FALSE","FALSE","FALSE"
"Wed. 22 July","Sushi Glory Hole","16:00","17:00","Museum of Bad Art / Bad Arts Residency","Downtown, grid square K19. Inside the museum","Food/Drinks","🦍 Adults only · 🖤 Sex positive","Instead of strange dick you'll be getting a snack. It's sushi being fed through a hole in the wall. So drop to your knees, open wide and get ready for some rice with fish on it.","","FALSE","TRUE","FALSE","TRUE","FALSE","FALSE","FALSE"
"Wed. 22 July","Erics Birthday Party ❤️🥳","16:00","17:30","Chai Chill Chinchilla","Swamp, grid square T17. The Party will take place right next to the Chai Chill Chinchilla Yurt","Party/Gathering","🐵 Kid-friendly · 🌈 Queer-inclusive","D — Hype/Chaos-Energie (242 Zeichen)

ERIC IS 31! Time to relive the golden age of birthday parties: potato races, chocolate-unwrapping with gloves, freeze dance showdowns. Chai Chill Chinchilla yurt, all ages of chaos welcome. Bring snacks, bring energy and gifts for Eric if you want.","","TRUE","FALSE","TRUE","FALSE","FALSE","FALSE","FALSE"
"Wed. 22 July","Salsa LA","16:00","17:00","Einar & Lia / DansBanderLand","Swamp, grid square T19. The LED dansbana (= pavilion)","Workshop/Class","","Workshop on the basics of LA Salsa. Salsa is a latino partner dance originally from Cuba, LA Salsa is a style developed in Los Angeles.","","FALSE","FALSE","FALSE","FALSE","FALSE","FALSE","FALSE"
"Wed. 22 July","The Rosewater Cult Extravaganza","16:00","19:00","The High(est) Priestess of the Rosewater Cult / Disciples of Alba - Constellations","Eastern Slope, grid square V19. We're in the Constellations Neighborhood in the Eastern Slope","Food/Drinks","","Have you always wanted to explore Borderland? But also want to party? And you refuse to choose because choosing is for people with self-control? The High(est) Priestesses of the Rosewater Cult x Disciples of Alba invite you to a sacred party procession across Borderland. Wear pink.","","FALSE","FALSE","FALSE","FALSE","FALSE","FALSE","FALSE"
"Wed. 22 July","Floorwork n feet","16:00","17:00","Leo / Fire Brigade","Swamp, grid square S16. In The Swamp at Fire Plaza, a gallery and red carpet area opposite the large tent of CIRCUS the ANALOG.","Workshop/Class","","Have you run out of limbs to spin your stick on? Fear not. In this workshop we will explore rolling about on the floor, manipulating contact and dragon staffs with our legs and feet. Some sticks available, bring your own if you have :)","","FALSE","FALSE","FALSE","FALSE","FALSE","FALSE","FALSE"
"Wed. 22 July","Turkish Coffee & Baklava","16:00","17:00","Haky & Merci / Haky & Merci","Arctic chill, grid square L08. Orange Van","Food/Drinks","😇 Sober","Come, whoever or whatever you are, and share with us a cup of delicious Turkish coffee and a sweet baklava.","Recurring: expanded to 6 days (Mon. 20 July, Tue. 21 July, Wed. 22 July, Thu. 23 July, Fri.); shown on: Wed. 22 July","FALSE","FALSE","FALSE","FALSE","TRUE","FALSE","FALSE"
"Wed. 22 July","Singers and players recording session","16:00","19:00","Tamiros / Jam Camp","Lowlands, grid square R13.","Music/Performance/Show","","Want a memory recorded from this burn in a form of audio recording of you singing / rapping / playing an instrument on house beats? Come sing or play an instrument over our house beats","","FALSE","FALSE","FALSE","FALSE","FALSE","FALSE","FALSE"
"Wed. 22 July","Bistro Francais","16:00","19:00","Le Bistro Francais","Lowlands, grid square Q12. We welcome you at the Lowlands Plaza","Food/Drinks","🐵 Kid-friendly","A corner of Paris in the woods — wine, peanuts, and the art of l’Apéro.","Recurring: expanded to 6 days (Mon. 20 July, Tue. 21 July, Wed. 22 July, Thu. 23 July, Fri.); shown on: Wed. 22 July","TRUE","FALSE","FALSE","FALSE","FALSE","FALSE","FALSE"
"Wed. 22 July","Drop your Act - Unmasking Until you meet the Unknown","16:00","17:30","Mystical Cowboy / Many Mad Mystics","Arctic chill, grid square N06.","Workshop/Class","","Ever wonder what’s hiding behind all those masks you wear? Come strip away the fake stuff, explore who you actually are underneath, and maybe discover something weird, mystical and wonderful in the process. We’ll peel back the layers a few times, get uncomfortable, get real, and possibly meet the deep unknown. No judgment, just honest chaos and self-discovery. All the real magic happens when you stop pretending. Will you dare to?","","FALSE","FALSE","FALSE","FALSE","FALSE","FALSE","FALSE"
"Wed. 22 July","OPENING VERNISSAGE AT THE MUSEUM OF BAD ART","16:00","18:00","MUSEUM OF BAD ART","Downtown, grid square K19. Lower floor of the Barn (also known as the Living Room)","Art/Installation","","We are honored to finally welcome you to the opening vernissage at the world’s first museum solely dedicated to Bad Arts, and the aesthetic, artistic and academic center for the Bad Arts movement. Expect red wine, difficult words, pretentious debates, a human chocolate fountain and lots of Bad Arts.","","FALSE","FALSE","FALSE","FALSE","FALSE","FALSE","FALSE"
"Wed. 22 July","BDSM Party","16:00","18:00","Hrm Fellonia & Fries / Njorunns Garden","Downtown, grid square M20.","Music/Performance/Show","💥 Sensory content","BubblesDowntempoStrawberryMeringue- party

Do you love the slower vibes? Do you love to dress up in your sluttiest outfit and indulge?
So you like bubbles and strawberries? 
Then this BDSM party is for you!
We are celebrating our 1 year anniversary with our favorite things, Bubbles, Downtempo, Strawberries, Meringue and getting dirty!
Put on you sluttiest you, bring out your dirtiest moves pop those bubbles and celebrate with us!","","FALSE","FALSE","FALSE","FALSE","FALSE","TRUE","FALSE"
"Wed. 22 July","Collective Senbazuru making","16:00","17:30","Noé / Shimmering by the forest edge","Arctic chill, grid square O06. In the Arctic Chill, close to Pamper Plaza, behind the camp ""Women who supports women""","Crafting/Pimping/Arting","🦍 Adults only","Learn how to fold origami cranes and, if you wish, hang them in our tipi to create a collective artwork. Folding one doesn't take long, you can show up at any time in the slot.","","FALSE","FALSE","FALSE","TRUE","FALSE","FALSE","FALSE"
"Wed. 22 July","VOICEWORK","16:00","18:00","Kenia / Spaceport","Lowlands, grid square P12. Dome by the tall pink temple, Lowlands","Workshop/Class","","Welcome to this dynamic & playful vocal workshop!
Beyond words and set melodies,  we'll improvise & explore the correllation between body and sound, movement and bodylanguage. Seriously fun and madly liberating","","FALSE","FALSE","FALSE","FALSE","FALSE","FALSE","FALSE"
"Wed. 22 July","<3 Special shower <3","16:00","17:00","Special shower","Sunny Hills, grid square H19","Weird shit/Other","🦍 Adults only · 💥 Sensory content","For one hour only! Special shower will be offering the most unique of experiences. We will gather and store the graywater from the Hot sauna and you get to use it as shower water. Never before has it been possible to take a shower with the ass sweat of thousands of hippies. First come first served!","","FALSE","FALSE","FALSE","TRUE","FALSE","TRUE","FALSE"
"Wed. 22 July","Sacred Earth dance meditation","16:00","17:00","Radiant / Tea by the Sea","Bison - South, grid square P23. Tea by the sea is located next to the lookout the big red roofed tea house next to Metal Bison","Ritual/Ceremony","","In this musical group meditation we celebrate being alive on this Earth and pledge our gratitude and devotion to our Sacred Earth. Our process involves vivid dancing, quiet reflection, and shared hugs.","","FALSE","FALSE","FALSE","FALSE","FALSE","FALSE","FALSE"
"Wed. 22 July","Heartbeat Rave and Brainwave Art","16:00","18:00","Clara & Niki / The Observatory","Swamp, grid square Q19.","Art/Installation","💥 Sensory content","Merge with others through interactive audiovisual heart and brain biofeedback stimulation.","","FALSE","FALSE","FALSE","FALSE","FALSE","TRUE","FALSE"
"Wed. 22 July","THE ORACLE","16:00","17:00","The Oracle camp","Arctic chill, grid square P08. Find the Oracle camp close to Kidsville and the toilets.
A place of balance","Ritual/Ceremony","💥 Sensory content","Bring your life question. 
The Oracle will reveal the answer.
Leave with clarity , confusion, or both","","FALSE","FALSE","FALSE","FALSE","FALSE","TRUE","FALSE"
"Wed. 22 July","Tufts & Tufthunters","16:00","18:00","The Royal Snail at The Jolly Jousters and onwards / The Royal Snail","Lowlands, grid square P12. At Jousting Tournament and onward from there","Art/Installation","💥 Sensory content","Sweet plebs and underlings of the Borderland - this is your chance to up your status. Come play the game and be ready to take on a whole new character and place in society. Work on your royal wave, your Marie Antoinette impressions, don your poor paper boy hats and prepare to Tufthunt like you never have before. Off with their heads! Or off their heads? Who knows, but it will be a party and it will suitably be after the jousting tournee with the Jolly Jousters. All in favour? Ay!","","FALSE","FALSE","FALSE","FALSE","FALSE","TRUE","FALSE"
"Wed. 22 July","Beavers & Nymphs Go Swimming!","16:00","18:00","Nyxie / The Sapphic Pond","Sunny Hills, grid square J21. Look for the lesbian flag, we fly it on a pole and spread it on the ground at the Pond, right by the Police Clown. Every day at 16:00 we march from there down to the water with the flag held high. Just follow the pink, orange and white stripes (and the trail of happy sapphics heading for a swim) 🐸","Games/Play","🦍 Adults only · 🌈🌈 Queer-focused","Every day at 16:00 we rise from the Pond and parade to the lake, lesbian flag flying, for 2 hours of swimming, floating, splashing and sun. Beavers, nymphs & neighbours all welcome to join the procession. Come get wet with us 💦🏳️‍🌈 Meet at the Pond, follow the flag.","Recurring: expanded to 7 days (Mon. 20 July, Tue. 21 July, Wed. 22 July, Thu. 23 July, Fri.); shown on: Wed. 22 July","FALSE","FALSE","TRUE","TRUE","FALSE","FALSE","FALSE"
"Wed. 22 July","Ecstatic Breastfeeding","16:00","18:00","Aapo & Omi-peah / Touch Divine","Wedge, grid square R22. At the south-east corner of BL, in a neighborhood called The Wedge.","Workshop/Class","🦍 Adults only · 🌈 Queer-inclusive · 🖤 Sex positive","In this ritual / workshop, we work collectively with the archetype of the nursing mother and the layers of energy which flow magically between nurturing & pleasure. Regardless of gender, we go into states of receiving and giving through exploration of touch (especially chest and nipples) on ourselves and others, guided by respect, gentleness and curiosity.","","FALSE","TRUE","TRUE","TRUE","FALSE","FALSE","FALSE"
"Wed. 22 July","Thai partner massage","16:00","17:30","Daniel / Yggdrasil","Highlands, grid square O10. in the big Tipi","Workshop/Class","","This is a 2x40min guided session of thai massage which is fully clothed and uses bodyweight to soften dense muscles, calm the nervous system and relax our bodies. You will work in pairs, come with a friend or make new friends.","","FALSE","FALSE","FALSE","FALSE","FALSE","FALSE","FALSE"
"Wed. 22 July","Making love in the moss","16:00","18:00","","Bison - South, grid square P23. Meet up at the Tree house Bison South","Art/Installation","🦍 Adults only · 🖤 Sex positive","Bring a partner and make love on the moss forest floor in closeness of others.","","FALSE","TRUE","FALSE","TRUE","FALSE","FALSE","FALSE"
"Wed. 22 July","Threesome Massage – Màșșàgé à Troïș","16:30","18:00","James / Cuddle Cloud","Wedge, grid square R21. We're located in the Wedge neighbourhood, across the road from a swamp with a massive rock","Workshop/Class","🦍 Adults only","Get the feeling of a threesome without the icky fluids! Sensual, mildly sexual, experimental massage in your underwear between 3 warm souls. Bring a blanket/towel + triangle friends or find them here. Touch, body folding and 3D massage techniques. No penetration –for plausible deniability 😉🙈❤️‍🔥18+","","FALSE","FALSE","FALSE","TRUE","FALSE","FALSE","FALSE"
"Wed. 22 July","The Game for Champignons","16:30","18:00","Brent Chister / End of the Block Lounge","Swamp, grid square U16. We are where The Swamp, The Missing Piece and The Lowlands meet!","Games/Play","🦍 Adults only","Do you have what it takes to reach fungal equilibrium? Whether as a team of contestants or merely as a spectator, come join Brent Chister and Skip Halloway as they test Borderlings, such as yourselves, on their knowledge of psychoactive, mycelium and burner-cultural knowledge while getting to also showcase some of their inner talents for cocktails, edible prizes, recipes, fun and of course, Borderland street cred.","","FALSE","FALSE","FALSE","TRUE","FALSE","FALSE","FALSE"
"Wed. 22 July","Vampire Orgy (Bite bite bounce)","16:30","18:30","David & Sola / End of the Rainbow","Bison - North, grid square N20. Cross from downtown garden over the wooden bridge by  the wood storage or enter from the Shameless Plaza below Club Sin","Workshop/Class","🦍 Adults only · 😇 Sober · 🖤 Sex positive","This workshop is a facilitated group play where the only allowed form of interaction is biting. We will invite you to interact with each other in many different constellations, biting and being bitten. The focus: playing as a larger group, and fluidly getting in and out of different constellations. We will start slow and sensual and build up to a true biting orgy.
Bring a towel or a blanket to lie on.","","FALSE","TRUE","FALSE","TRUE","TRUE","FALSE","FALSE"
"Wed. 22 July","Guided Nonsense","16:30","17:30","Lucy / Pink Parachute","Lowlands, grid square P13.","Games/Play","🐵 Kid-friendly","Come and play, with nothing and everything, imagine worlds and of course some silliness, lots of it! Shhhhh what is there when you can listen?","","TRUE","FALSE","FALSE","FALSE","FALSE","FALSE","FALSE"
"Wed. 22 July","Flash mob pillow fight","16:30","17:00","Ultramarine","Sunny Hills, grid square G21. Lakeside Plaza, outside Magic Banya where you see a group carrying pillows...","Games/Play","🐵 Kid-friendly","Let's have a flash mob for a friendly pillow fight! 
Let's play by Burnberry Rules, aka no strike on person on the ground, no strike on innocent bystanders (person w/o pillow), if someone raise both hands they should be granted safe passage out of the fight. No excessive force. Also LNT, if your pillow rupture, help clean up afterwards. You can play with any soft pillowish object, inside out bag for sleeping bag, stuff sack.","","TRUE","FALSE","FALSE","FALSE","FALSE","FALSE","FALSE"
